{"candidate_id":"candidate-scl-c9c7ba342981c6e2","deadline":"2026-05-18T00:00:00+00:00","estimated_compute_cost":{"seconds":300,"tier":"medium"},"expected_output_schema":"trinity-useful-compute-result/v0.4","input_bundle_sha256":"bf014271b9ff63b0b874b135ad64c8806e1a81c44f59832e39ad54875dafc806","manual_review_required":false,"max_reward_stocks":100000,"metadata":{"scientific_intake":{"combined_context_sha256":"bf014271b9ff63b0b874b135ad64c8806e1a81c44f59832e39ad54875dafc806","documents_count":5,"intake_artifact_sha256":"3d931c6ed1fc2a6b463620c532b708df0dc695343de366b085e4c2bfb04a5fd1","intake_id":"spi-9ef73a7652f60afc","intake_task_kind":"comparison","prompt_sha256":"6e6468dbb09b3efc013c0737b9ba2c554bca33e87e5cee2d5ce3902f8dc2e511"},"scientific_reader_manifest":{"combined_context_sha256":"bf014271b9ff63b0b874b135ad64c8806e1a81c44f59832e39ad54875dafc806","documents":[{"extracted_text_sha256":"18e2a1b04ba915dbe5fd8515794be1ce8fe15841d3eb6a92869d5fe1f9b51946","path_basename":"sample.md","reader_kind":"text","reader_status":"ok","sha256":"18e2a1b04ba915dbe5fd8515794be1ce8fe15841d3eb6a92869d5fe1f9b51946","structured_summary":{"char_count":122,"line_count":7},"warnings":[]},{"extracted_text_sha256":"e3b0c44298fc1c149afbf4c8996fb92427ae41e4649b934ca495991b7852b855","path_basename":"sample.pdf","reader_kind":"pdf","reader_status":"unsupported_missing_dependency","sha256":"30d883524f9432fa1e3029dbc32bf02c73ad74c3818c476e1de2b6ea9ee4bffa","structured_summary":{"page_count":0,"pdf_backend":null},"warnings":["no PDF backend available (pypdf or PyPDF2 not importable); text extraction skipped"]},{"extracted_text_sha256":"3abd225a59eed70daf08da5b65376bd9664b3e8126a1b0012bb0909f1d68cfa8","path_basename":"sample.txt","reader_kind":"text","reader_status":"ok","sha256":"3abd225a59eed70daf08da5b65376bd9664b3e8126a1b0012bb0909f1d68cfa8","structured_summary":{"char_count":116,"line_count":3},"warnings":[]},{"extracted_text_sha256":"16db66b0539601b7ef77143a25af667fb1059b36a307e178772e298d0399a204","path_basename":"sample.tex","reader_kind":"latex","reader_status":"ok","sha256":"981f688432d27cdd658a91edfe224fb9ca5ea3deea88adf3794cde50d1db68fb","structured_summary":{"char_count_extracted":118,"char_count_raw":145,"has_document_env":false,"section_count":1},"warnings":[]},{"extracted_text_sha256":"d061253de9461c9bc63f04a3304174ca9731c48f263787da5d884cbb3ae89316","path_basename":"sample.csv","reader_kind":"csv","reader_status":"ok","sha256":"bb0778cf23c9e7888017f0226db414c4512eb2f113d9e4cf687bf23c3cae34a5","structured_summary":{"column_count":3,"header":["compound","oxygen_storage_mmol_g","temperature_c"],"preview_rows":[["compound","oxygen_storage_mmol_g","temperature_c"],["CeO2","0.42","500"],["PrOx","0.58","500"]],"row_count":3},"warnings":[]}],"documents_count":5,"intake_warnings":["sample.pdf: no PDF backend available (pypdf or PyPDF2 not importable); text extraction skipped"],"reader_kind_counts":{"csv":1,"latex":1,"pdf":1,"text":2},"reader_status_counts":{"ok":4,"unsupported_missing_dependency":1}},"scientific_task_classification":{"candidate_materials":["CeO2","PrOx"],"candidate_metrics":["compound","oxygen_storage_capacity","oxygen_storage_mmol_g","redox_potential","temperature","temperature_c"],"classification_id":"scl-c9c7ba342981c6e2","confidence":"high","proposed_difficulty_class":"medium","proposed_source_tool":"materials_engine","source_intake_id":"spi-9ef73a7652f60afc","source_intake_sha256":"3d931c6ed1fc2a6b463620c532b708df0dc695343de366b085e4c2bfb04a5fd1","task_kind":"comparison","threat_refs":["T01","T04","T09"]}},"public_description":"Trinity scientific task classification from intake spi-9ef73a7652f60afc (task_kind=comparison) materials=CeO2,PrOx metrics=compound,oxygen_storage_capacity,oxygen_storage_mmol_g,redox_potential,temperature,temperature_c","request_id":"uc-935e2632223823b0","schema":"trinity-useful-compute-request/v0.1","source_tool":"materials_engine","task_type":"scientific_intake","validation_method":"deterministic_hash_check"}